{
  "alwm_version": "0.2.1",
  "artifacts": {
    "campaign_analysis_json": "reports/campaign-analysis.json",
    "campaign_comparative_report_md": "reports/campaign-report.md",
    "campaign_manifest": "manifest.json",
    "campaign_result_pack_json": "campaign-result-pack.json",
    "campaign_semantic_summary_json": "campaign-semantic-summary.json",
    "campaign_semantic_summary_md": "campaign-semantic-summary.md",
    "campaign_summary_json": "campaign-summary.json",
    "campaign_summary_md": "campaign-summary.md",
    "index_md": "INDEX.md"
  },
  "campaign_created_at": "1970-01-01T00:00:00Z",
  "campaign_definition_fingerprint": "sha256:98d0b9852fa277dc5b164fe14a3711b50be2a72ea5f5fca5ed0dd09fe8072566",
  "campaign_experiment_fingerprints": {
    "browser_configs": "sha256:591cbc3aa572200862e2f336261f05849fe93c17d226a939565815d0cb075961",
    "campaign_definition": "sha256:98d0b9852fa277dc5b164fe14a3711b50be2a72ea5f5fca5ed0dd09fe8072566",
    "prompt_registry_state": "sha256:d409ed75b3cb355ac6727f09877d7ef98c40adce16e3e8284c6dcfe9c5c3db21",
    "provider_configs": "sha256:69c4ef3c9876f8d46bd609d755baa1bb850cd8d9fdcbdee0748b6e10c36cf5f1",
    "scoring_configs": "sha256:2c7f1b6d79305cde67076936152d80992802d413157de43143bac86c13c21fc8",
    "suite_definitions": "sha256:d2b3773206bf3494af78922b52603f56a48e60aea74a7f40998fc98adbafbeca"
  },
  "campaign_id": "campaign.examples.multi_suite.v1",
  "campaign_run_count": 2,
  "created_at": "1970-01-01T00:00:00Z",
  "definition_source_relpath": "examples/campaigns/v1/multi_suite.v1.yaml",
  "fixture_mode_force_mock": true,
  "git_commit_sha": "148517589c625e7fc468c35311d0bcd6939462bd",
  "git_describe": "v0.2.2-dirty",
  "included_member_count": 2,
  "layout_version": 1,
  "longitudinal_member_glob": "runs/*/manifest.json",
  "member_depth": "full",
  "member_runs": [
    {
      "benchmark_id": "bench.fixtures.campaign.micro.v1",
      "manifest_relpath": "runs/run0000/manifest.json",
      "run_id": "campaign.examples.multi_suite.v1__0000",
      "run_index": 0,
      "status": "succeeded",
      "suite_ref": "fixtures/benchmarks/campaign_micro.v1.yaml"
    },
    {
      "benchmark_id": "bench.offline.v1",
      "manifest_relpath": "runs/run0001/manifest.json",
      "run_id": "campaign.examples.multi_suite.v1__0001",
      "run_index": 1,
      "status": "succeeded",
      "suite_ref": "fixtures/benchmarks/offline.v1.yaml"
    }
  ],
  "pack_id": "multi-suite",
  "pack_identity_fingerprint": "sha256:46d10a886eefd7bac9439281c45998affea9c227fa16ed17839717bf6b305093",
  "schema_version": 1,
  "source_campaign_relpath": "examples/campaign_runs/multi_suite",
  "title": "Example \u2014 multi-suite sweep (two fixtures)"
}
